Tags,Question,Answer
python;ftp;ftplib;,Is there a special trick to downloading a zip file and writing it to disk with Python?,576238
python;django;django-models;django-project-architect;,"Django Project structure, recommended structure to share an extended auth ""User"" model across apps?",576345
python;,Is it required to learn Python 2.6 along with Python 3.0?,576557
python;pygame;keyboard-events;,PyGame not receiving events when 3+ keys are pressed at the same time,576634
python;decorator;ttl;,Writing a TTL decorator in Python,576776
python;user-interface;winapi;tkinter;,Is there a known Win32 Tkinter bug with respect to displaying photos on a canvas?,576843
python;sqlite;,How can I reference columns by their names in python calling SQLite?,576933
php;python;sms;mobile-phones;bulksms;,How do I design sms service?,576940
python;file;csv;,How can I change a huge file into csv in python,576967
python;import;module;,How to exit a module before it has finished parsing?,577119
python;dictionary;,"Python ""extend"" for a dictionary",577234
python;gtk;pygtk;,gtk TextView widget doesn't update during function,577302
python;django;django-signals;,Django - how do I _not_ dispatch a signal?,577376
python;command-line;,Pause in Python,577467
python;math;opengl;,Rotating a glViewport?,577639
python;linux;unix;,How do I prevent Python's os.walk from walking across mount points?,577761
python;,Python Socket help (Syntax error),577779
python;ruby;qt4;pyqt;,PyQt: No such slot,577824
python;recursion;,How can I make this Python recursive function return a flat list?,577940
python;scroll;wxwidgets;scrolledwindow;,Easiest way to create a scrollable area using wxPython?,578200
python;pys60;,Python 2.5 to Python 2.2 converter,578262
python;,Python program to find fibonacci series. More Pythonic way,578379
python;variables;pass-by-reference;,How to pass values by ref in Python?,578635
python;for-loop;anti-patterns;,Alternative to 'for i in xrange(len(x))',578677
python;wxpython;wxwidgets;,"AuiNotebook, where did the event happend",578800
python;,Need help understanding function passing in Python,578812
python;package;python-import;,Python package import error,578983
python;design-patterns;error-handling;warnings;,Is there a pattern for propagating details of both errors and warnings?,579097
c#;.net;python;ironpython;cross-language;,Instantiating a python class in C#,579272
python;formatting;string;integer;,formatting long numbers as strings in python,579310
python;http;http-headers;wsgi;middleware;,WSGI byte ranges serving,579426
python;django;orm;,Using only the DB part of Django,579511
python;design-patterns;,Wrapping objects to extend/add functionality while working around isinstance,579620
python;clipboard;,How do I copy a string to the clipboard on Windows using Python?,579687
python;sqlite;orm;auto-generate;,Python ORM that auto-generates/updates tables and uses SQLite?,579770
python;variables;pass-by-reference;,Change basic (immutable) types inside a function in Python?,579782
python;,What's the Pythonic way to combine two sequences into a dictionary?,579856
python;pywin32;,Need help debugging python html generator,580397
python;variables;loops;,Persisting variable value in Python,580866
python;windows;file-attributes;,Python windows File Version attribute,580924
python;regex;performance;,regex '|' operator vs separate runs for each sub-expression,580993
python;cherrypy;,Python web programming,581038
python;user-interface;wxpython;doublebuffered;,Double buffering with wxpython,581085
python;integration;scipy;numerical-methods;,Can someone explain why scipy.integrate.quad gives different results for equally long ranges while integrating sin(X)?,581186
python;c;python-3.x;python-c-api;,Python C-API Object Initialisation,581281
c#;python;,Similar to Pass in Python for C#,581343
python;temporary-files;,"In Python, how do I make a temp file that persists until the next run?",581851
python;performance;profiling;time-complexity;,How can you profile a Python script?,582336
python;sqlite;sqlalchemy;py2exe;,py2exe + sqlalchemy + sqlite problem,582449
python;packages;,How to import classes defined in __init__.py,582723
python;linux;sysadmin;sudo;root;,"Run a linux system command as a superuser, using a python script",583216
python;coding-style;,What is the best way to print a table with delimiters in Python,583557
python;django;,Django development server shutdown error,583740
python;google-app-engine;zip;in-memory;,Is it possible to generate and return a ZIP file with App Engine?,583791
python;django;authentication;wsgi;middleware;,"How does one enable authentication across a Django site, and transparently preserving any POST or GET data?",583857
python;user-interface;gtk;pygtk;,PyGTK widget opacity,583906
python;,"How would I make the output of this for loop into a string, into a variable?",583986
python;tkinter;,tkinter - set geometry without showing window,584127
python;osx;beanstalkd;,Problems on select module on Python 2.5,584575
python;ftp;,Determine if a listing is a directory or file in Python over FTP,584865
python;database;django;design;sqlite;,Database design of survey query system,585006
python;,Find all strings in python code files,585529
python;nokia;pys60;,About the optional argument in Canvas in PyS60,585957
jquery;python;django;django-models;csv;,What are good ways to upload bulk .csv data into a webapp using Django/Python?,586517
python;regex;multiline;,Python regular expression matching a multiline block of text,587345
python;,How to increment a value with leading zeroes?,587647
python;for-loop;,a question on for loops in python,588052
python;django;design-patterns;google-app-engine;django-apps;,Is there a Django apps pattern equivalent in Google App Engine?,588342
c#;c++;python;c;console-application;,How to produce a colored GUI in a console application?,588622
python;packaging;setuptools;distutils;,Python Daemon Packaging Best Practices,588749
python;subprocess;popen;,Python persistent Popen,589093
python;linux;pylons;,Miminal Linux For a Pylons Web App?,589115
python;mysql;,imploding a list for use in a python MySQLDB IN clause,589284
python;windows;unix;logging;file-io;,Python - How to check if a file is used by another application?,589407
python;regex;,How to find a relative URL and translate it to an absolute URL in Python,589833
python;ironpython;cpython;,Python or IronPython,590007
python;audio;chat;voice;,Video and Voice chat operability in Python,590053
python;module;,How to change a Python module name?,590250
python;django;model-inheritance;,How can I query a model by if there is a subclass instance?,590653
python;django;django-models;,Django - designing models with virtual fields?,590921
python;decorator;,Can I use a decorator to mutate the local scope of a function in Python?,591200
python;random;,"When using random, which form returns an equal 50% chance?",591253
python;windows;passwords;,How can I modify password expiration in Windows using Python?,591300
python;variables;syntax-error;,python variables not accepting names,591421
python;winapi;,Python Win32 - DriveInfo On Mapped Drive,591443
cpython;python;,How can you programmatically tell the CPython interpreter to enter interactive mode when done?,591520
python;function;pygame;,pygame function appears to be being ignored,591776
python;visualization;prefuse;,Is there a python equivalent of the prefuse visualization toolkit?,591839
python;multithreading;,In Python what is the preferred way to create and manage threads?,592143
python;c;winapi;pid;,Fast way to determine if a PID exists on (Windows)?,592256
python;orm;sqlalchemy;sqlobject;,Any reasons not to use SQLObject over SQLAlchemy?,592332
python;data-binding;qt4;pyqt4;,PyQt4: Databinding?,592404
python;css;screen-scraping;beautifulsoup;html-content-extraction;,Parsing an HTML file with selectorgadget.com,592910
python;,Why doesn't Python have static variables?,592931
python;math;,Python for mathematics students?,593685
python;image-processing;python-imaging-library;,How do I find images with a similar color using Python and PIL?,593925
python;parsing;equation;,Equation parsing in Python,594266
python;switch-statement;,Choosing between different switch-case replacements in Python - dictionary or if-elif-else?,594442
python;console;ipython;console2;,Console2 and Ipython output issues,594471
python;email;message;payload;,Email body is a string sometimes and a list sometimes. Why?,594545
python;,Make a python property with the same name as the class member name,594856
python;cryptography;,How to load an RSA key from a PEM file and use it in python-crypto,595114
python;symbian;nokia;s60;pys60;,Does PyS60 has a reliable garbage collection?,595290
python;symbian;nokia;pys60;,Does the stack limit of Symbian also apply to PyS60?,595296
python;builtin;pep;,What's the Python function like sum() but for multiplication? product()?,595374
python;user-interface;wxpython;toolbars;,wxPython toolbar help,596190
python;performance;web.py;,How do I use python for web development without relying on a framework?,596729
python;file;readline;,AttributeError: 'str' object has no attribute 'readline',596886
python;xml;,xml.dom.minidom: Getting CDATA values,597058
python;,Converting an object into a subclass in Python?,597199
python;networking;ipv6;,Python: Getting an IPv6 socket to receive packets destined for the Subnet-Routers Anycast address,597225
python;amazon-s3;,Python: efficiently join chunks of bytes into one big chunk?,597289
c#;.net;python;html-to-pdf;,"FOSS HTML to PDF in Python, .Net or command line?",597348
python;mouse;pygame;draw;paint;,How to create MS Paint clone with Python and pygame,597369
python;regex;coding-style;,How to concisely cascade through multiple regex statements in Python,597476
java;python;performance;jython;benchmarking;,Why Jython behaves inconsistently when tested with PyStone?,597483
python;windows;service;,How do I create a windows service with Python,597572
python;email;turbogears;,How can i use TurboMail 3 together with TurboGears 2,598019
python;decorator;new-style-class;,Why does @foo.setter in Python not work for me?,598077
python;performance;exception-handling;,Cheap exception handling in Python?,598157
python;dependencies;distribution;packaging;,When is it (not) appropriate to bundle dependencies with an application?,598299
python;,Searching a list of objects in Python,598398
python;,Calling function defined in exe,598569
python;django;administration;,What SHOULDN'T Django's admin interface be used for?,598577
python;google-app-engine;google-cloud-datastore;,AppEngine: Query datastore for records with <missing> value,598605
python;graph;visualization;matplotlib;,Where is the function get_example_data in matplotlib? It seems to be missing but its in examples/tutorials,598626
python;python-module;python-import;,External classes in Python,598668
python;html;xpath;lxml;,How to match a text node then follow parent nodes using XPath,598722
python;string;,Python HTML removal,598817
python;mysql;boolean;,Working with MySQL booleans in python,598879
python;c;,Difference between class (Python) and struct (C),598931
python;,What's the best technology for connecting from linux to MS SQL Server using python? ODBC?,598979
python;google-app-engine;setuptools;pkg-resources;,How can I manually register distributions with pkg_resources?,599205
python;json;aim;,Authentication Required - Problems Establishing AIM OSCAR Session using Python,599218
python;django;http;,How to pass information using an HTTP redirect (in Django),599280
python;weak-references;,Why doesn't the weakref work on this bound method?,599430
python;file;directory;,How do I tell a file from directory in Python?,599474
python;unicode;ascii;,Python string prints as [u'String'],599625
python;bluetooth;nokia;pys60;,PyS60: Bluetooth sockets,599737
python;string;,How to remove the left part of a string?,599953
python;design;,Python: Choosing between modules and classes,600190
python;google-app-engine;e-commerce;satchmo;,How to make Satchmo work in Google App Engine,600225
python;mkdir;,mkdir -p functionality in Python,600268
python;urllib;,Python error when using urllib.open,600389
python;ide;debugging;,What features would a *perfect* Python debugger have?,600401
python;google-search;,Why does Google Search return HTTP Error 403?,600536
python;clr;ironpython;boo;,BOO Vs IronPython,600539
.net;javascript;python;ajax;,Making a 2-player web-based textual game,600621
python;exception-handling;downloading;,how to time-out gracefully while downloading with python,600848
python;vim;,VIM: Save and Run at the same time?,601039
python;beautifulsoup;,Issues with BeautifulSoup parsing,601166
python;osx;,Recommendations for Python development on a Mac?,601236
python;django;mapping;geodjango;,Should I use GeoDjango for mapping a floor plan?,601442
python;numpy;,Best way to create a NumPy array from a dictionary?,601477
python;tokyo-cabinet;,Python Table engine binding for Tokyo Cabinet,601865
python;image-processing;,Digital Image cropping in Python,601874
python;comments;docstring;,How to write meaningful docstrings?,601900
python;linear-equation;,Solution basis of underdetermined equation set in python,601941
python;django;,Store last created model's row in memory,602030
python;typechecking;,Should I check the types of constructor arguments (and at other places too)?,602046
python;conventions;,Do many Python libraries have relatively low code quality?,602096
jquery;python;html;google-app-engine;dhtml;,Differential AJAX updates for HTML table?,602322
python;std;,Evil code from the Python standard library,602445
c++;python;class;,How can I use C++ class in Python?,602580
python;debugging;pdb;,How to show the output of 'l' in python pdb after every command entered,602599
python;module;,How can I access the current executing module or class name in Python?,602846
python;csv;text-files;,python opens text file with a space between every character,603115
python;regex;,Finding anchor text when there are tags there,603199
python;html-parsing;lxml;,Need python lxml syntax help for parsing html,603287
python;qt;qt4;pyqt;qcombobox;,"Using PyQT, how do you filter mousePressEvent for a QComboBox with custom list",603528
python;django;,What is the proper way to address permissions?,603595
python;syntax;for-loop;generator;yield;,Using for...else in Python generators,603641
python;wxpython;drawing;,How would you draw cell borders in a wxPython FlexGridSizer?,603831
python;multicast;,Multicast in Python,603852
python;urllib2;,How do you get default headers in a urllib2 Request?,603856
python;django;forms;model;,Django set default form values,604266
python;audio;signal-processing;fft;spectrum;,Analyze audio using Fast Fourier Transform,604453
python;perl;,"Does Python have something like Perl 5.10's ""state"" variables?",604622
python;perl;,How would you translate this from Perl to Python?,604721
python;webcam;,How do I access my webcam in Python?,604749
python;multithreading;sockets;timer;packet;,python: how to send packets in multi thread and then the thread kill itself,605013
python;scoping;,Python variable assigned by an outside module is accessible for printing but not for assignment in the target module,605399
c++;python;observer-pattern;publish-subscribe;,Python's PubSub/observer Pattern for C++?,605629
python;python-sphinx;,What's the search engine used in the new Python documentation?,605888
python;cookies;mechanize-python;,Python: how to dump cookies of a mechanize.Browser instance?,606072
python;string;python-3.x;,Convert bytes to a Python string,606191
python;regex;,python regex trouble,606221
python;linux;configuration;path;,How do I configure my sys.path variable in linux?,606226
python;python-sphinx;,How do I install python's sphinx documentation generator in linux?,606283
python;regex;debugging;,How can I debug a regular expression in python?,606350
python;python-module;,How to get filename of the __main__ module in Python?,606561
python;visual-studio-2005;visual-studio-2003;distutils;,Can I use VS2005 to build extensions for a Python system built with VS2003,606680
python;django;validation;,Model and Validation Confusion - Looking for advice,606782
python;django;forms;,Django Override form,606946
python;constructor;multiple-inheritance;super;python-2.5;,"How does Python's ""super"" do the right thing?",607186
python;file;,Preserving last new line when reading a file,607375
python;email;message;postfix-mta;,Integrate postfix mail into my (python)webapp,607548
python;regex;parsing;text-parsing;,Python parsing,607760
python;django;email;django-email;,Django email,607819
python;qt;sqlite;pyqt4;pywin32;,What will I lose or gain from switching database APIs? (from pywin32 and pysqlite to QSql),608098
python;file-io;commit;buffering;,is there COMMIT analog in python for writing into a file?,608316
python;,Python port binding,608558
python;cocoa;osx;idle-processing;,Monitoring user idle time,608710
python;django;,django- run a script from admin,608789
python;windows;,Getting the name of the active window,608809
python;compilation;python-imaging-library;,python PIL install on shared hosting,608854
python;setuptools;,Excluding a top-level directory from a setuptools package,608855
python;ruby;list;yield;,Creating lists using yield in Ruby and Python,608951
python;vim;syntax;syntax-highlighting;,Is there anything that cannot appear inside parentheses?,609169
python;ide;editor;python-idle;,How can I stop IDLE from printing giant lists?,609190
python;,PY: Url Encode without variable name,609212
python;sqlite;pysqlite;,pysqlite user types in select statement,609516
python;django;django-admin;,<class> has no foreign key to <class> in Django when trying to inline models,609556
python;,Problems title-casing a string in Python,609830
python;django;charts;,Charts in django Web Applications,609944
python;yahoo-pipes;simplejson;,"Yahoo Pipes, simplejson and slashes",610205
python;,Catching Python exceptions using 'expect' method?,610403
java;python;,Is there something like CherryPy or Cerise in the Java world?,610516
python;attributes;,How to know if an object has an attribute in Python,610883
python;graph;procedural-generation;,What is a good strategy for constructing a directed graph for a game map (in Python)?,610892
python;django;django-models;django-admin;,Django Model Inheritance. Hiding or removing fields,611691
python;django;,Can you give a Django app a verbose name for use throughout the admin?,612372
python;introspection;python-datamodel;,Problem using super(python 2.5.2),612468
python;django;swfupload;,Code samples for Django + SWFUpload?,612734
python;cygwin;cmd;pipe;,Python one-liner to print every file in the current directory,613007
python;perl;hash;hmac;,Why do I get wrong results for hmac in Python but not Perl?,613111
python;sorting;dictionary;,Sort a Python dictionary by value,613183
python;windows-vista;recycle-bin;,How does Vista Recycle bin work?,613246
python;perl;compiler-construction;static-analysis;use-strict;,"Is there a need for a ""use strict"" Python compiler?",613364
python;ip-address;tcp;,Discovering public IP programatically,613471
python;pygtk;twisted;,Adding twisted code to a pygtk app,613777
python;regex;,Why is the regular expression returning an error in python?,614205
python;regex;string;,How do i write a regular expression for the following pattern in python?,614458
python;datetime;date;,"Tool/library for calculating intervals like ""last thursday of the month""",614518
python;cairo;,Big images with cairo,614949
python;,How to detect errors from compileall.compile_dir?,615632
python;django;django-models;localization;,Django labels and translations - Model Design,616187
python;recursion;,Is it possible to remove recursion from this function?,616416
python;tcsh;,Python in tcsh,616440
python;tee;,How do I duplicate sys.stdout to a log file in python?,616645
python;recursion;iteration;,Iterative version of Python's deepcopy,617097
iphone;python;google-app-engine;web-applications;,How do I detect if my appengine app is being accessed by an iphone/ipod touch?,617202
python;stream;popen;eof;,"Python Popen, closing streams and multiple processes",617308
python;python-2.5;poplib;,Poplib not working correctly?,617892
python;bash;alias;,How do I make this python command line an alias in bash?,617952
python;range;,How to find whether a number belongs to a particular range in Python?,618093
python;windows;wxpython;error-reporting;,Prevent wxPython from showing 'Unhandled exception' dialog,618429
python;regex;,Python regex split a string by one of two delimiters,618551
python;django;http;,Django: using <select multiple> and POST,618557
python;google-app-engine;jinja2;,Optimizing Jinja2 Environment creation,618827
python;python-dateutil;rrule;,dateutil.rrule.rrule.between() gives only dates after now,618910
python;ant;build-automation;,Python build/release system,618958
python;metaclass;,Python metaclasses,618960
python;wxpython;wxwidgets;,Set the size of wx.GridBagSizer dynamically,619163
python;django;orm;,Tools to ease executing raw SQL with Django ORM,619384
python;interpreter;pypy;,"What does PyPy have to offer over CPython, Jython, and IronPython?",619437
python;performance;proxy;,Will python provide enough performance for a proxy?,619575
python;django;django-models;backup;django-forms;,"What is the best way to represent a schedule in a database, via Python/Django?",619592
python;imaging;,Using pixel fonts in PIL,619618
python;django;authentication;django-authentication;custom-backend;,Do Django custom authentication backends need to take a password?,619620
python;mysql;subprocess;,Supplying password to wrapped-up MySQL,619804
python;windows;automation;,Progammatically restart windows to make system logs think user logged out,620154
python;datetime;,Convert Year/Month/Day to Day of Year in Python,620305
python;django;,How to import a Django project settings.py Python file from a sub-directory?,620342
python;text-files;,How to jump to a particular line in a huge text file?,620367
python;types;,What's the best way to find the closest matching type to an existing type?,620530
python;sql;sqlalchemy;,SQLAlchemy Obtain Primary Key With Autoincrement Before Commit,620610
python;pickle;,Why do I get unexpected behavior in Python isinstance after pickling?,620844
python;components;syntax-highlighting;,do you know of any python component(s) for syntax highlighting?,620954
python;dictionary;coin-change;,Python function: Find Change from purchase amount,621062
python;django;forms;,Django Forms Newbie Question,621121
python;mysql;database;,Accessing a MySQL database from python,621156
python;django;forms;,Another Django Forms : Foreign Key in Hidden Field,621212
python;unicode;,How to print tuples of unicode strings in original language (not u'foo' form),621321
python;,How to slice a list from an element n to the end in python?,621354
python;regex;,What does re.compile(r'[[]]') match?,621560
python;encryption;key;,Python and random keys of 21 char max,621649
python;django;comet;daemon;,Choosing and deploying a comet server,621802
python;cgi;,.cgi problem with web server,621874
python;import;mysql;,Unable to import python-mysqldb,621968
python;reflection;type-conversion;introspection;python-datamodel;,Python Reflection and Type Conversion,622161
python;events;wxpython;wxwidgets;,How to change cursor position of wxRichTextCtrl in event handler?,622417
python;django;django-models;,Increment Page Hit Count in Django,622652
python;installation;sudo;,Unable to install Python without sudo access,622744
python;python-imaging-library;crop;,"Python, PIL, crop problem",622783
python;django;forms;django-forms;,Django Passing Custom Form Parameters to Formset,622982
python;multithreading;,"For my app, how many threads would be optimal?",623054
python;wxpython;rtf;richtextctrl;,How can I insert RTF into a wxpython RichTextCtrl?,623384
python;google-maps;s60;pys60;,Retrieving the latitude/longitude from Google Map Mobile 3.0's MyLocation feature,623504
python;attributes;object;,Why can't I directly add attributes to any python object?,623520
python;plugins;trac;,How do you add event to Trac event time line,623822
python;django;django-authentication;,django login middleware not working as expected,624043
python;qt;wxpython;pyqt;,wx's idle and UI update events in PyQt,624050
asp.net;python;,What should I be aware of when moving from asp.net to python for web development?,624062
python;twill;mechanize-python;,Twill/Mechanize access to html content,624232
python;django;django-forms;,How do I make a Django ModelForm menu item selected by default?,624265
python;html;css;pygments;,How can I customize the output from pygments?,624345
python;easy-install;,Why am I getting an invalid syntax easy_install error?,624492
python;django;django-admin;styles;look-and-feel;,Using Django admin look and feel in my own application,624535
python;setuptools;failed-installation;,Unable to install python-setuptools: ./configure: No such file or directory,624671
python;signals;django-signals;,Why aren't signals simply called events?,624844
python;,how to detect whether a python variable is a function?,624926
python;google-app-engine;,What will be the upgrade path to Python 3.x for Google App Engine Applications?,625042
python;oop;,Python __init__ and self what do they do?,625083
python;gmail;pop3;poplib;,Select mails from inbox alone via poplib,625148
python;sqlalchemy;lighttpd;cherrypy;,"Best practice for integrating CherryPy web-framework, SQLAlchemy sessions and lighttpd to serve a high-load webservice",625288
