Tags,Question,Answer
python;osx;fonts;photoshop;,How can I find the full path to a font from its display name on a Mac?,469
python;windows;image;pdf;,Get a preview JPEG of a PDF on Windows?,502
python;continuous-integration;extreme-programming;,Continuous Integration System for a Python Codebase,535
python;sql;database;oracle;cx-oracle;,cx_Oracle: How do I iterate over a result set?,594
python;arrays;iteration;,Using 'in' to match an attribute of Python objects in an array,683
python;django;views;oop;,Class views in Django,742
python;mysql;postgresql;bpgsql;,Python and MySQL,766
python;iteration;,How do I use Python's itertools.groupby()?,773
python;oop;methods;monkeypatching;,Adding a Method to an Existing Object Instance,972
python;syntax;binary;integer;literals;,How do you express binary literals in Python?,1476
python;xml;database;protocol-buffers;,Any experiences with Protocol Buffers?,1734
python;,How do I make a menu that does not require the user to press [enter] to make a selection?,1829
python;,How to check what OS am I running on in Python?,1854
python;list;tuples;,"Python: what is the difference between (1,2,3) and [1,2,3], and when should I use each?",1983
php;python;ftp;webserver;,File size differences after copying a file to a server vía FTP,2311
python;user-interface;deployment;tkinter;release-management;,How can I create a directly-executable cross-platform GUI app using Python?,2933
python;,Calling a function of a module from a string with the function's name in Python,3061
python;linux;osx;serial-port;,Programmatically talking to a Serial Port in OS X or Linux,3976
php;python;ruby-on-rails;ruby;,How to sell Python to a client/boss/person with lots of cash,4942
python;apache;apache2;,How do you set up Python scripts to work in Apache 2.0?,5102
python;c;matlab;,Does anyone have experience creating a shared library in MATLAB?,5136
python;user-interface;markup;,"Cross Platform, Language Agnostic GUI Markup Language?",5313
python;floating-point;,Convert Bytes to Floating Point Numbers in Python,5415
python;unicode;,"Python, Unicode, and the Windows console",5419
python;urllib;,Get size of a file before downloading in Python,5909
python;data-structures;,Best way to abstract season/show/episode data,5966
python;mysql;pylons;,Pylons error - 'MySQL server has gone away',8154
python;xml;dom;xpath;nodes;,How to use Xpath in Python?,8692
python;mp3;metadata;,Accessing mp3 Meta-Data with Python,8948
python;,How do I treat an integer as an array of bytes in Python?,10123
c++;python;unit-testing;code-generation;swig;,How should I unit test a code-generator?,11060
python;xml;lxml;,Using an XML catalog with Python's lxml?,12591
python;doctest;,Can you check that an exception is thrown with doctest in Python?,12592
.net;python;arrays;loops;iteration;,Replacement for for... if array iteration,13396
python;string;escaping;,Python version of PHP's stripslashes,13454
python;regex;backreference;,Python Regular Expressions to implement string unescaping,13791
python;functional-programming;closures;,Can you explain closures (as they relate to Python)?,13857
python;osx;audio;terminal;,"Python Sound (""Bell"")",13941
python;regex;zip;text-processing;,Is there a python module for regex matching in zip files,14281
python;regex;unicode;character-properties;,Regex and unicode,14389
python;xml;validation;dtd;,How do I validate xml against a DTD file in Python,15798
python;swig;ctypes;prototyping;python-sip;,Prototyping with Python code before compiling,16067
python;xss;,Sanitising user input using Python,16861
python;zip;,Create an encrypted ZIP file in Python,17250
python;command-line;packaging;,What's the best way to distribute python command-line tools?,17893
python;validation;naming;,How to check set of files conform to a naming scheme,19030
python;object;iterator;,Build a Basic Python Iterator,19151
python;list;matrix;unzip;transpose;,A Transpose/Unzip Function in Python (inverse of zip),19339
php;python;,Introducing Python,19654
python;command-line;command-line-arguments;,What's the best way to grab/parse command line arguments passed to a Python script?,20063
python;linux;symlink;,Find broken symlinks with Python,20794
python;database;django;orm;,updating an auto_now DateTimeField in a parent model w/ Django,20927
python;mysql;django;django-models;enums;,Specifying a mySQL ENUM in a Django model,21454
java;python;garbage-collection;,Why Java and Python garbage collection methods are different?,21934
python;datetime;,Why does this python date/time conversion seem wrong?,21961
python;ruby;semantics;zemanta;,"How do content discovery engines, like Zemanta and Open Calais work?",22059
python;django;unicode;,Unicode vs UTF-8 confusion in Python / Django?,22149
python;string-formatting;,Format numbers to strings in Python,22617
python;,How do I download a file over HTTP using Python?,22676
python;windows;process;subprocess;fork;,What's the best way to duplicate fork() in windows?,23397
python;ruby;git;lines-of-code;sloc;,How can I graph the Lines of Code history for git repo?,23907
python;visual-studio-2008;code-generation;,Python code generator for Visual Studio?,24193
python;windows;cmd;,How to capture Python interpreter's and/or CMD.EXE's output from a Python script?,24931
python;binary;io;buffer;,Binary buffer in Python,25116
python;gtk;pygtk;sdl;pygame;,pyGame within a pyGTK application,25661
python;reflection;,Python super class reflection,25807
python;,"Is there any difference between ""foo is None"" and ""foo == None""?",26595
python;user-interface;drag-and-drop;wxpython;wxwidgets;,wxpython: How do I examine dragged data in OnDragOver?,26706
python;translation;pypy;,Where can I learn more about PyPy's translation function?,27567
php;python;string;,Does PHP have an equivalent to this type of Python string substitution?,28165
python;security;,"Is ""safe_eval"" really safe?",28369
c;python;,Most Pythonic way equivalent for: while ((x = next()) != END),28559
python;linux;perl;scripting;filemaker;,Best way to extract data from a FileMaker Pro database in a script?,28668
python;refactoring;,What refactoring tools do you use for Python?,28796
python;web-services;soap;,What's the best way to use web services in python?,28961
python;xml;,How do I create an xml document in python,29243
python;linux;installer;debian;distutils;,Python distutils - does anyone know how to use it?,29562
python;osx;64bit;,Install Python to match directory layout in OS X 10.5,29856
python;multithreading;,"How do threads work in Python, and what are common Python-threading specific pitfalls?",31340
python;django;,How can I render a tree structure (recursive) using a django template?,32044
python;file-io;,Programmatically editing Python source,32385
python;windows;cross-platform;,"Is it possible to run a Python script as a service in Windows? If possible, how?",32404
python;unit-testing;parameterized-unit-test;,How to generate dynamic (parametrized) unit tests in python?,32899
python;ssh;,"ssh hangs when command invoked directly, but exits cleanly when run interactive",33475
python;,Extending base classes in Python,33534
python;performance;memory-profiling;,Find out how much memory is being used by an object in Python,33978
python;multithreading;,Are Python threads buggy?,34020
python;http;proxy;,How to specify an authenticated proxy for a python http connection?,34079
python;django;django-models;,Django ImageField core=False in newforms admin,34209
python;language-features;encapsulation;,Python descriptor protocol analog in other languages?,34243
python;windows;cross-platform;,How do I make Windows aware of a service I have written in Python?,34328
python;introspection;,Finding what methods an object has,34439
python;pylons;,Scaffolding in pylons,34916
python;html;validation;xhtml;,Validate (X)HTML in Python,35538
python;mapping;iteration;,Why does Python's iter() on a mapping return iterkeys() instead of iteritems()?,35569
python;ruby;,"Ruby ""is"" equivalent",35634
python;ide;,Is Python good for big software projects (not web based)?,35753
python;,Why is my instance variable not in __dict__?,35805
python;shell;escaping;,How to escape os.system() calls in Python?,35817
python;django;google-app-engine;,Django templates and variable attributes,35948
python;struct;,C-like structures in Python,35988
python;string;sorting;,How do I sort a list of strings in Python?,36139
python;svn-merge;,"""The system cannot find the file specified"" when invoking subprocess.Popen in python",36324
python;django;apache;mod-wsgi;,Setup django with WSGI and apache,36806
python;django;,How do I add data to an existing model in Django?,36812
python;syntax;parameter-passing;identifier;kwargs;,What does ** (double star) and * (star) do for Python parameters?,36901
python;python-3.x;enums;,How can I represent an 'Enum' in Python?,36932
python;parsing;resources;lex;,"Resources for lexing, tokenising and parsing in python",36953
python;ruby;multithreading;multicore;,How to make Ruby or Python web sites to use multiple cores?,37142
python;oop;inheritance;object;,How can I simply inherit methods from an existing instance?,37479
python;html;,Filter out HTML tags and resolve entities in python,37486
python;foxpro;dbf;visual-foxpro;,What's the easiest way to read a FoxPro DBF file from Python?,37535
python;class-method;,What are Class methods in Python for?,38238
python;oracle;ora-00932;,Retrieving an Oracle timestamp using Python's Win32 ODBC module,38435
python;variables;return;,What's the best way to return multiple values from a function in Python?,38508
python;django;,Using Django time/date widgets in custom form,38601
python;dictionary;mapping;expression;idioms;,How to merge two Python dictionaries in a single expression?,38987
python;file;,Search and replace a line in a file in Python,39086
python;distutils;,Finding a file in a Python module distribution,39104
python;udp;bits;bit-fields;,What is the best way to do Bit Field manipulation in Python?,39663
python;c;cross-platform;posix;scripting;,Using C in a shared multi-platform POSIX environment,39847
python;security;cross-platform;gnupg;,PGP signatures from Python?,39929
javascript;python;,javascript locals()?,39960
python;oracle;cx-oracle;,cx_Oracle: how do I get the ORA-xxxxx error number?,40586
python;executable;environment;shebang;,Python deployment and /usr/bin/env portability,40705
python;django;authentication;session;cookies;,Always including the user in the django template context,41547
python;monkeypatching;,How do I do monkeypatching in python?,41562
python;tuples;,Splitting tuples in Python - best practice?,41701
python;linux;cross-platform;desktop;,Standard way to open a folder window in linux?,41969
python;tuples;,What is a tuple useful for?,42034
python;ms-word;,Best way to extract text from a Word doc without using COM/automation?,42482
python;regex;python-2.x;,Python re.sub MULTILINE caret match,42581
python;date;,Get Last Day of the Month in Python,42950
python;dvcs;bazaar;,How can I get a commit message from a bzr post-commit hook?,43099
python;django;url;django-urls;,How to generate urls in django,43290
iphone;python;cocoa-touch;,Can I write native iPhone apps using Python,43315
python;sql;metadata;coupling;data-driven;,A python web application framework for tight DB/GUI coupling?,43368
python;mime;,How to find the mime type of a file in python?,43580
python;frameworks;cgi;wsgi;,Pros and Cons of different approaches to web programming in Python,43709
python;math;modulo;,Modulus operation with negatives values - weird thing?,43775
python;documentation;python-module;,How do I document a module in Python?,44084
python;oop;,Iterate over subclasses of a given class in a given module,44352
python;list;,How would you make a comma-separated string from a list?,44778
python;syntax;namespaces;,Can someone explain __all__ in Python?,44834
python;django;firefox;,Can the HTTP version or headers affect the visual appearance of a web page?,45013
python;packages;,"Python packages - import by class, not file",45122
python;performance;complexity-theory;big-o;sequences;,Where can I find the time and space complexity of the built-in sequence types in Python,45228
python;interface;wacom;,Wacom tablet Python interface,45500
python;favicon;,Is there a Python library for generating .ico files?,45507
python;tkinter;tk;,How to know whether a window with a given title is already open in Tk?,45540
python;x86;mips;elf;dwarf;,Analizing MIPS binaries: is there a Python library for parsing binary data?,45954
python;compatibility;,Which Version of Python to Use for Maximum Compatibility,47198
python;django;,Django: Print url of view without hardcoding the url,47207
python;iis;deployment;windows-server;iis-modules;,How do you set up a python wsgi server under IIS?,47253
python;debugging;,Is there a way to attach a debugger to a multi-threaded Python process?,47701
python;list-comprehension;generator;,Generator Expressions vs. List Comprehension,47789
python;authentication;sqlalchemy;pylons;authkit;,User Authentication in Pylons + AuthKit,47801
python;zip;packaging;software-distribution;egg;,What are the advantages of packaging your python library/application as an .egg file?,47953
python;gtk;pygtk;glade;gtk2;,Glade or no glade: What is the best way to use PyGtk?,48123
python;networking;,Embedding a remote Python shell in an application,48176
python;google-app-engine;,Project structure for Google App Engine,48458
python;svn;dos2unix;,How do I implement a pre-commit hook script in SVN that calls dos2unix to validate checked-in file,48562
python;google-app-engine;,Python: No module named core.exceptions,48777
c++;python;embedded-language;,Calling python from a c++ program for distribution,49137
python;deployment;egg;,How do I turn a python program into an .egg file?,49164
python;arrays;matlab;for-loop;,Can parallel traversals be done in MATLAB just as in Python?,49307
c++;python;pdf;passwords;encryption;,"How does one decrypt a PDF with an owner password, but no user password?",49455
java;python;,Java -> Python?,49824
python;matlab;numpy;numerical;scientific-computing;,Open source alternative to MATLAB's fmincon function?,49926
python;sysadmin;whois;,What Python way would you suggest to check whois database records?,50394
python;scripting;file;,How do I get the path and name of the file that is currently executing?,50499
python;django;session;caching;mongodb;,Django Sessions,50568
python;weak-references;,How do you create a weak reference to an object in Python?,50923
python;datetime;time;,What is the simplest way to find the difference between 2 times in python?,51010
python;http;,How to write a download progress indicator in Python?,51212
python;html;,How can I retrieve the page title of a webpage using Python?,51233
python;varargs;,Passing on named variable arguments in python,51412
python;readability;,Improving Python readability?,51502
python;path;relative-path;absolute-path;,How to get an absolute file path in Python,51520
python;sql;optimization;aggregate;olap;,Why are SQL aggregate functions so much slower than Python and Java (or Poor Man's OLAP),51553
python;windows;linux;osx;diskspace;,Cross-platform space remaining on volume using python,51658
python;,Large Python Includes,53027
python;syntax;line-breaks;long-lines;,How can I do a line break (line continuation) in Python?,53162
python;python-datamodel;,How do you check whether a python method is bound or not?,53225
python;list;,Best way to check if a list is empty,53513
python;ironpython;jython;cpython;,"What are some strategies to write python code that works in CPython, Jython and IronPython",53543
python;statistics;simulation;stress-testing;,How do i generate a histogram for a given probability distribution (for functional testing a server)?,53786
python;ajax;google-app-engine;,Any good AJAX framework for Google App Engine apps?,53997
python;class;oop;types;new-style-class;,What is the difference between old style and new style classes in Python?,54867
python;sorting;dictionary;list;,"In Python, how can you easily retrieve sorted items from a dictionary?",55180
python;emacs;ide;keyboard;,How can I get Emacs' key bindings in Python's IDLE?,55365
python;regex;screen-scraping;,Python regular expression for HTML parsing (BeautifulSoup),55391
python;xml;xhtml;,XML writing tools for Python,56229
python;erp;dabo;,Anyone used Dabo for a medium-big project?,56417
python;floating-point;,round() in Python doesn't seem to be rounding properly,56820
python;html;entities;,Convert XML/HTML Entities into Unicode String in Python,57708
python;regex;exception;,Does re.compile() or any given Python library call throw an exception?,58119
python;sockets;,How do I get the external IP of a socket in Python?,58294
python;documentation;doxygen;docstring;python-sphinx;,Can I document Python code with doxygen (and does it make sense)?,58622
python;user-interface;frameworks;,"How would you design a very ""Pythonic"" UI framework?",58711
python;arrays;,Storing multiple arrays in Python,59648
python;set;,How to retrieve an element from a set without removing it?,59825
python;linux;firefox;ubuntu;automation;,Automate firefox with python?,60152
python;switch-statement;,Replacements for switch statement in Python?,60208
python;version-control;distutils;,Can distutils create empty __init__.py files?,60352
python;windows-mobile;,Windows Mobile development in Python,60446
c++;python;linux;cross-platform;ipc;,cross platform IPC,60649
python;webserver;,How do I write a python HTTP server to listen on multiple ports?,60680
python;regex;,python regex to match multi-line preprocessor macro,60685
python;sql;database;sqlalchemy;,Getting random row through SQLAlchemy,60805
python;dictionary;,How do you retrieve items from a dictionary in the order that they're inserted?,60848
python;unit-testing;code-organization;,Where do the Python unit tests go?,61151
python;dictionary;attributes;object;metaprogramming;,Python dictionary from an object's fields,61517
python;function;return-value;,Is it pythonic for a function to return multiple values?,61605
python;iis;asp-classic;vbscript;cgi;,python cgi on IIS,61781
python;google-app-engine;,What's a good way to find relative paths in Google App Engine?,61894
php;python;benchmarking;,Comparing runtimes,62079
python;,"Is there a way around coding in Python without the tab, indent & whitespace criteria?",63086
python;mercurial;hook;,Which is the most useful Mercurial hook for programming in a loosely connected team?,63488
python;delphi;,How create threads under Python for Delphi,63681
python;class;,Classes in Python,64141
python;gis;yahoo;,Nice Python wrapper for Yahoo's Geoplanet web service?,64185
python;django;,When to create a new app (with startapp) in Django?,64237
python;google-app-engine;,How can I access App Engine through a Corporate proxy?,64362
python;client;,Best Python supported server/client protocol?,64426
python;smtp;,Sending mail from Python using SMTP,64505
python;vim;configuration;spaces;,How to setup VIM autoindentation properly for editing Python files - *.py,65076
python;regex;caching;,Caching compiled regex objects in Python?,65266
python;metaclass;,How to add method using metaclass,65400
python;oop;inheritance;,Decorating a parent class method,66636
python;gtk;pygtk;gobject;,How do I create a new signal in pygtk,66730
python;mysql;xampp;mysql-error-2006;,"mod_python/MySQL error on INSERT with a lot of data: ""OperationalError: (2006, 'MySQL server has gone away')""",67180
python;opengl;pyglet;,why might my pyglet vertex lists and batches be very slow on Windows?,67223
python;django;,Serving dynamically generated ZIP archives in Django,67454
python;configuration;python-import;python-module;,How to import a module given the full path?,67631
python;,"Why do you need explicitly have the ""self"" argument into a Python method?",68282
python;user-interface;tkinter;,Change command Method for Tkinter Button in Python,68327
python;ssh;automation;scp;,How to copy a file to a remote server in Python using SCP or SSH?,68335
python;post;file-upload;http-post;,Send file using POST from a Python script,68477
python;osx;libxml2;,libxml2-p25 on OS X 10.5 needs sudo?,68541
python;performance;python-internals;,Are tuples more efficient than lists in Python?,68630
python;class;methods;static;class-variables;,Static class variables in Python,68645
python;networking;tcp;,Best way to open a socket in Python,68774
python;linux;screenshot;,Take a screenshot via a python script. [Linux],69645
python;authentication;cgi;,Can I implement a web user authentication system in python without POST?,69979
python;python-2.7;encapsulation;information-hiding;,Why are Python's 'private' methods not actually private?,70528
python;authentication;desktop;,Python Authentication API,70653
python;mysql;psycopg2;,Python Psycopg error and connection handling (v MySQLdb),70681
python;input;command-line-arguments;,Python: user input and commandline arguments,70797
python;import;,HTML parser in Python,71151
python;metaclass;,Using the docstring from one method to automatically overwrite that of another method,71817
python;regex;,"Python and ""re""",72393
python;unit-testing;,Python's unittest logic,72422
python;python-import;python-module;,How to do relative imports in Python?,72852
python;list;sorting;dictionary;,How do I sort a list of dictionaries by values of the dictionary in Python?,72899
python;django;model-view-controller;model;,How to create a triple-join table with Django,72945
python;windows;cluster-computing;pywin32;,Is there a python package to interface with MS Cluster?,73439
python;termination;,Terminating a Python script,73663
python;email;sendmail;,Sending mail via sendmail from python,73781
python;types;,Is there a common way to check in Python if an object is any function type?,74092
python;,Random in python 2.5 not working?,74430
python;,How do I get the name of a python class as a string?,75440
python;django;,How to use form values from an unbound form,75621
python;django;frameworks;,Django -vs- Grails -vs-?,75798
python;sql;sqlalchemy;,Best way to access table instances when using SQLAlchemy's declarative syntax,75829
python;gtk;text-editor;undo;,Undo with GTK TextView,76096
php;python;performance;pylons;,"Which is faster, python webpages or php webpages?",77086
python;ruby-on-rails;ruby;flex;blazeds;,"What does BlazeDS Livecycle Data Services do, that something like PyAMF or RubyAMF not do?",77198
python;,'id' is a bad variable name in Python,77552
python;orm;ibatis;,iBATIS for Python?,77731
python;math;3d;geometry;,What's the best way to calculate a 3D (or n-D) centroid?,77936
python;user-interface;opengl;,OPENGL User Interface Programming,78238
python;bash;redirect;diff;vimdiff;,Redirect command to input of another in Python,78431
python;reportlab;,Python ReportLab use of splitfirst/splitlast,78450
python;oop;,Is there a benefit to defining a class inside another class in Python?,78799
python;memory-leaks;valgrind;guile;,How to check for memory leaks in Guile extension modules?,78900
python;unit-testing;user-interface;tdd;,Testing GUI code: should I use a mocking library?,79454
python;email;,How do I get started processing email related to website activity?,79602
python;unit-testing;,Unittest causing sys.exit(),79754
python;datetime;utc;,How do I convert local time to UTC in Python?,79797
python;database;google-app-engine;bigtable;,How do you design data models for Bigtable/Datastore (GAE)?,79850
python;regex;,Split a string by spaces -- preserving quoted substrings -- in Python,79968
c#;python;btrieve;,Btrieve without Pervasive?,80215
c#;python;design-patterns;,PubSub lib for c#,80347
python;asynchronous;twisted;,Asychronous Programming in Python Twisted,80617
python;exception;atexit;,How to skip sys.exitfunc when unhandled exceptions occur,80993
python;activestate;,PythonWin's python interactive shell calling constructors twice?,81191
python;google-app-engine;,Upload files in Google App Engine,81451
python;qt;gtk;pyqt;,PyQt and PyCairo,82180
python;dns;dnspython;,Python + DNS : Cannot get RRSIG records: No Answer,82607
python;django;,"Is there any list of blog engines, written in Django?",82653
python;file;filesystems;,How do I check whether a file exists using Python?,82831
python;networking;windows-xp;,How to programmatically enable/disable network interfaces? (Windows XP),83756
python;,Why isn't the 'len' function inherited by dictionaries and lists in Python,83983
python;frameworks;,Running multiple sites from a single Python web framework,85119
python;,Python - time.clock() vs. time.time() - accuracy?,85451
python;network-programming;,Search for host with MAC-address using Python,85577
python;cross-platform;qa;error-reporting;,How to best implement simple crash / error reporting?,85985
python;,What are the pros and cons of the various Python implementations?,86134
python;xml;xpath;parent-child;xml-attribute;,Get list of XML attribute values in Python,87317
python;asp-classic;vbscript;,"If it is decided that our system needs an overhaul, what is the best way to go about it?",87522
python;shell;mercurial;mercurial-hook;,Setting Environment Variables for Mercurial Hook,88194
python;django;,How do you configure Django for simple development and deployment?,88259
python;unit-testing;exception;,How do I unit test an __init__() method of a python class with assertRaises()?,88325
c++;python;input;,"In Python, how do you take tokenized input such as with the C++?",88554
python;string;list;split;,How do I split a string into a list?,88613
python;shell;command;subprocess;external;,Calling an external command in Python,89228
