Tags,Question,Answer
python;multithreading;,Is there an easy way to tell how much time is spent waiting for the Python GIL?,795405
python;numpy;,Correlate one set of vectors to another in numpy?,795570
python;google-app-engine;count;,Google AppEngine: how to count a database's entries beyond 1000?,795817
python;file-io;mod-python;,How do you open and transfer a file on the filesystem in mod_python?,795837
python;django;rss;django-templates;simplepie;,Is there anything in the Django / Python world equivalent to SimplePie Plugin for Wordpress?,795976
python;scripting;,Wrapping a script with subprocess.Popen(),795977
python;postgresql;datetime;timezone;,Can't subtract offset-naive and offset-aware datetimes,796008
.net;python;ironpython;bytearray;,IronPython - Convert int to byte array,796197
javascript;python;django;django-admin;,How to limit choice field options based on another choice field in django admin,796466
python;html;parsing;semantics;html-content-extraction;,python method to extract content (excluding navigation) from an HTML page,796490
python;cgi;,CGI & Python,796906
python;windows;sockets;setsockopt;,Is windows's setsockopt broken?,796957
python;django;,How to query filter in django without multiple occurrences,796971
python;string;format;,string formatting,797132
python;,import statement fails for one module,797241
python;ide;debugging;pyscripter;,how can I debug more than one script in pyscripter?,797754
python;,"Python ""protected"" attributes",797771
python;django;caching;,Django caching - can it be done pre-emptively?,797773
python;multithreading;ipc;process;interaction;,How to make two python programs interact?,797785
python;sql;coding-style;indentation;pretty-print;,Algorithm for neatly indenting SQL statements (Python implementation would be nice),798180
python;refactoring;,Python tool that builds a dependency diagram for methods of a class,798389
python;perl;domainkeys;dkim;,"How to call a Perl script from Python, piping input to it?",798413
python;subclass;set;instance-variables;,"What is the correct (or best) way to subclass the Python set class, adding a new instance variable?",798442
python;combinations;,All combinations of a list of lists,798854
python;exception;,Python exceptions: call same function for any Exception,799293
python;apache;cgi;,Configure Apache to use Python just like CGI PHP,799354
python;django;datetime;,Print long integers in python,799434
javascript;python;,"Python html output (first attempt), several questions (code included)",799479
python;windows;networking;,Getting name of windows computer running python script?,799767
python;google-app-engine;,How to get last inserted item's key in google app engine,799803
python;formatting;floating-point;,keeping same formatting for floating point values,800015
python;file;,How to get all of the immediate subdirectories in Python,800197
python;,How to initialize variables to None/Undefined and compare to other variables in Python?,800248
python;user-interface;python-3.x;,About GUI editor that would be compatible with Python 3.0,800769
c#;python;scipy;nmath;,C# Nmath to Python SciPy,801128
python;django;forms;html-form;,Django equivalent of PHP's form value array/associative array,801354
python;google-app-engine;,Updating data in google app engine,801477
python;informix;,Why Python informixdb package is throwing an error!,801515
python;django;model;,How to put timedelta in django model?,801912
python;architecture;containers;notifications;,Notifying container object: best practices,801931
python;urllib2;user-agent;,Changing user agent on urllib2.urlopen,802134
java;python;face-detection;,Face-tracking libraries for Java or Python,802243
c++;python;winapi;enumeration;,How can I enumerate/list all installed applications in Windows XP?,802499
java;python;keyword;final;,`final` keyword equivalent for variables in Python?,802578
python;exception;,Python - Possible to force raise exceptions regardless try/except blocks?,802804
python;subprocess;,Getting realtime output using subprocess,803265
python;google-app-engine;,Inserting multiple model instances using a single db.put() on Google App Engine,803517
python;django;list;,Merge two lists of lists - Python,803526
python;multithreading;deadlock;embedding;,Python embedding with threads -- avoiding deadlocks?,803566
python;django;fckeditor;mod-wsgi;,How do you use FCKEditor's image upload and browser with mod-wsgi?,803613
python;function;,Passing functions with arguments to another function in Python?,803616
python;url;unicode;utf-8;,Best way to convert a Unicode URL to ASCII (UTF-8 percent-escaped) in Python?,804336
python;code-analysis;,Tool to determine what lowest version of Python required?,804538
python;mod-wsgi;yield;,mod_wsgi yield output buffer instead of return,804898
python;xml;django;rest;,How to consume XML from RESTful web services using Django / Python?,804992
python;subprocess;,How to use subprocess when multiple arguments contain spaces?,804995
python;inheritance;class;object;,Call a parent class's method from child class in Python?,805066
python;django;json;google-maps;markerclusterer;,Server Side Google Markers Clustering - Python/Django,805072
python;,"Python ""Task Server""",805120
python;perl;,How can I get the results of a Perl script in Python script?,805160
c++;python;layout;graphics;visualization;,Learning Graphical Layout Algorithms,805356
python;sql;django;stored-procedures;django-models;,What is the best way to access stored procedures in Django's ORM,805393
python;django;,How to get field names when running plain sql query in django,805660
python;google-app-engine;url;templates;web-applications;,how to avoid hard-coding urls in webapp templates,805751
python;templates;python-sphinx;,Sphinx automated image numbering/captions?,805943
php;c++;python;perl;fastcgi;,FastCGI C++ vs. A Script Language (PHP/Python/Perl),805957
python;hash;numpy;sha1;pickle;,How to hash a large object (dataset) in Python?,806151
python;encryption;,Can I encrypt email and decrypt it back using python default library set?,806739
python;django;,Django: Redirect to previous page after login,806835
python;stdin;,Python equivalent of Perl's while (<>) {...}?,807173
python;email;phpmailer;,Where is the phpMailer php class equivalent for Python?,807302
python;django;orm;m2m;,"Django m2m queries, distinct Users for a m2m relationship of a Model",807470
python;file-io;,How to output list of floats to a binary file in Python,807863
python;django;utf-8;lxml;decoding;,Decoding problems in Django and lxml,808275
python;html;xml;,Printing XML into HTML with python,808529
python;parsing;object;,Parsing files with Python,808621
c#;python;.net;ironpython;python.net;,Creating an interactive shell for .NET apps and embed scripting languages like python/iron python into it,808692
python;multithreading;loops;,Python - Threading and a While True Loop,808746
python;regex;screen-scraping;extract;,Find all IPs on an HTML Page,809037
python;django;django-models;django-managers;,Django Manager Chaining,809210
python;statistics;,How to calculate cumulative normal distribution in Python,809362
python;unit-testing;,distributed/faster python unit tests,809564
python;unicode;python-2.6;unicode-literals;,Any gotchas using unicode_literals in Python 2.6?,809796
python;multithreading;pygtk;,How to work with threads in pygtk,809818
python;regex;mediawiki;,Python regex for finding contents of MediaWiki markup links,809837
python;,Biggest python projects,810055
python;osx;configuration;screen-scraping;beautifulsoup;,python- is beautifulsoup misreporting my html?,810173
python;django;forms;widget;admin;,Django form field using SelectDateWidget,810308
python;unicode;codepages;,string encodings in python,810794
python;django;django-models;,how to manually assign imagefield in Django,811167
php;python;web-applications;unicode;,Is it possible to write a great PHP app which uses Unicode?,811306
python;urllib2;,reading a stream made by urllib2 never recovers when connection got interrupted,811446
python;qt;qt4;tkinter;ipython;,How to scroll automaticaly within a Tkinter message window,811532
python;database;sqlite;,Sqlite and Python -- return a dictionary using fetchone()?,811548
python;windows;security;excel;,How can I create a locked-down python environment?,811670
python;multithreading;timeout;,Python Timeout,811692
python;syntax-error;genshi;,What causes this Genshi's Template Syntax Error?,811737
python;standards;production;supervisord;,"What version of Python (2.4, 2.5, 2.6, 3.0) do you standardize on for production development efforts (and why)?",812085
python;distutils;,How can I get my setup.py to use a relative path to my files?,812242
python;logging;,Why does python logging package not support printing variable length args?,812422
python;logging;,How many times was logging.error() called?,812477
python;resources;module;resx;,Resources (resx) with Python,812644
python;c;compiler-construction;,Python's bz2 module not compiled by default,812781
python;delegates;multithreading;,Thread Finished Event in Python,812870
python;user-interface;wxpython;,How to debug wxpython applications?,812911
python;voip;,I want to make a temporary answerphone which records MP3s,813114
python;,Does Python have properties?,813135
python;ruby;string;,Ruby String Translation,813147
python;shell;,Embedding a Python shell inside a Python program,813571
python;functional-programming;bytecode;,Is there a way to check whether function output is assigned to a variable in Python?,813882
python;apache2;pylons;mod-wsgi;,"If I want to use a pylons app with Apache, should I use mod_wsgi or proxy to paste?",813943
python;osx;osx-leopard;berkeley-db;bsddb;,How to Fix the Broken BSDDB Install in the Default Python Package on Mac OS X 10.5 Leopard?,814041
python;windows;py2exe;,"PY2EXE: How to output ""*_D.PYD"" file (debug) and use MSVCR80D.DLL?",814078
python;,Easiest way to rm -rf in Python,814167
python;html;parsing;screen-scraping;lxml;,Python lxml screen scraping?,814227
python;regex;,Python regex parsing,814786
python;database;design;google-app-engine;cron;,google app engine - design considerations about cron tasks,814896
python;regex;,python regular exp. with a unicode char,814933
python;caching;decorator;,Is there a decorator to simply cache function return values?,815110
python;,How to designate unreachable python code,815310
python;hash;twitter;md5;,Detecting Retweets using computationally inexpensive Python hashing algorithms,815313
python;,Python imports from crossreferencing packages,815367
php;asp.net;python;webserver;,C# Web Server: Implementing a Dynamic Language,815446
python;svn;,How to use subversion Ctypes Python Bindings?,815530
python;django;feeds;parsing;,How do you remove html tags using Universal Feed Parser?,815606
python;metaclass;,callable as instancemethod?,815947
python;distribution;probability;simpy;,"Python, SimPy: How to generate a value from a triangular probability distribution?",815969
python;visualization;plot;scientific-computing;,Scientific Plotting in Python,816086
python;django;rss;feeds;parsing;,What's a good way to mix RSS feeds using Python?,816118
python;windows;installation;simpy;,What is wrong with this SimPy installation?,816156
python;ruby;mobile;operating-system;dynamic-languages;,Python/Ruby as mobile OS,816212
python;html;django;html-entities;,How to unescape apostrophes and such in Python?,816272
python;unicode;ascii;,"Where is Python's ""best ASCII for this Unicode"" database?",816285
python;refactoring;pylint;,Python: avoiding pylint warnings about too many arguments,816391
python;google-app-engine;templates;django-templates;web-applications;,how to get the url of the current page in a GAE template,816683
python;selenium;,save an image with selenium & firefox,816704
python;beautifulsoup;,Dynamically change range in Python?,816712
python;user-interface;wxpython;widget;,wxPython: A foldable panel widget,816887
python;function;,Call a function with argument list in python,817087
python;regex;digits;,Delete digits in Python (Regex),817122
python;django;django-forms;django-admin;,Overriding the save method in Django ModelForm,817284
python;debugging;google-app-engine;netbeans;,NetBeans debugging of Python (GAE),817407
python;facebook;,Update Facebooks Status using Python,817431
python;random;seed;,Python's random: What happens if I don't use seed(someValue)?,817705
python;session;,Unique session id in python,817882
python;dictionary;,Creating dictionaries with pre-defined keys,817884
python;css;reddit;,C55: More Info?,818016
python;parallel-processing;mpi;,MPI4Py Scatter sendbuf Argument Type?,818362
python;cgi;,Letting users upload Python scripts for execution,818402
python;oop;python-3.x;metaclass;,Shouldn't __metaclass__ force the use of a metaclass in Python?,818483
python;regex;search;replace;nltk;,"Python: Replace string with prefixStringSuffix keeping original case, but ignoring case when searching for match",818691
python;regex;list-comprehension;,Spliting a file into lines in Python using re.split,818705
php;python;mysql;,Web-Based Music Library (programming concept),818752
python;loops;for-loop;range;,Is it possible to implement a Python for range loop without an iterator variable?,818828
python;parsing;text-files;,Parse a .txt file,818936
python;user-interface;cross-platform;wxpython;,WxPython: Cross-Platform Way to Conform Ok/Cancel Button Order,818942
python;string;integer;numbers;,How to convert strings numbers to integers in a list?,818949
python;sqlite;unicode;,Is there a way to correctly sort unicode strings in SQLite using Python?,819211
python;cgi;,"Python, who is calling my python module",819217
python;encoding;,Working with a QString encoding,819310
python;networking;ip-address;,How can I check if an ip is in a network in python,819355
python;encoding;ansi;utf-16;,Best way for Parsing ANSI and UTF-16LE files using Python 2/3?,819396
python;multithreading;exception;,How do I handle exceptions when using threading and Queue?,820111
python;opengl;cairo;,Render PyCairo onto PyOpenGL surface?,820221
python;,How can I make a change to a module without restarting python interpreter?,820431
python;google-app-engine;url;unicode;friendly-url;,rules for slugs and unicode,820496
python;exception;descriptor;readonlyattribute;,"python, __slots__, and ""attribute is read-only""",820671
python;treeview;syntax-error;maya;,Why is Maya 2009 TreeView control giving a syntax error on drag?,820697
python;string;multiple-inheritance;immutability;,How to bestow string-ness on my class?,820742
python;django;,SyntaxError in finally (Django),820778
python;beautifulsoup;,"Where can I find some ""hello world""-simple Beautiful Soup examples?",821173
python;tsql;,SQL TOP 1 analog for lists in Python,821416
python;language-features;,what python feature is illustrated in this code?,821855
python;sockets;buffering;,Python sockets buffering,822001
python;text;encoding;file;binary;,How to separate content from a file that is a container for binary and other forms of content,822161
python;emacs;pabbrev;,Emacs Pabbrev and Python,822195
python;regex;,I need a regex for the href attribute for an mp3 file url in python,822260
python;beautifulsoup;,How do I iterate over the HTML attributes of a Beautiful Soup element?,822571
python;apache;logging;mod-python;,logging in mod_python/apache,822875
python;,"Elegant, pythonic solution for forcing all keys and values to lower case in nested dictionaries of Unicode strings?",823030
python;profiling;,What's the best way to record the type of every variable assignment in a Python program?,823103
python;recursion;simpy;,Why is this recursive statement wrong?,823141
python;configuration;yaml;,Yaml merge in Python,823196
python;syntax;,What does += mean in Python?,823561
python;osx;wxpython;,App dock icon in wxPython,824458
python;initialization;arguments;instantiation;,Initialisation of keyword args in Python,824924
python;python-imaging-library;tkinter;tk;,Why in the world does Python's Tkinter break using canvas.create_image?,824988
python;sql;mysql;database;,How do you make the Python Msqldb module use ? in stead of %s for query parameters?,825042
python;django;date;widget;,Change/adapt date widget on admin interface,825253
python;dns;hostname;,Extract domain name from a host name,825694
python;exception-handling;try-catch;runtime-error;,Catch only some runtime errors in Python,825909
python;abstract-class;multiple-inheritance;mixins;,Abstract class + mixin + multiple inheritance in python,825945
python;django;admin;case;,Changing case (upper/lower) on adding data through Django admin site,825955
python;,Python: finding uid/gid for a given username/groupname (for os.chown),826082
python;,How do I convert a string 2 bytes long to an integer in python,826284
python;list;list-comprehension;,List Comprehensions and Conditions?,826407
python;file;loops;while-loop;,Python: Mixing files and loops,826493
python;com;virtualbox;,Controlling VirtualBox via COM from Python?,826494
python;google-app-engine;gae-datastore;custompaging;,how to get the n-th record of a datastore query,826724
python;shell;join;csv;debian;,Combining 2 .csv files by common column,826812
python;crontab;,crontab in python,826882
python;unit-testing;dbus;hal;,Unit testing for D-Bus and HAL?,827295
python;windows;,Is there a way to list all the available drive letters in python?,827371
python;django;web-applications;unicode;pylons;,Should my python web app use unicode for all strings?,827415
python;regex;google-app-engine;,How do you validate a URL with a regular expression in Python?,827557
python;linux;terminal;,Python interpreter with Linux Screen,827879
python;scons;,How do I constrain the SCons Command builder to run only if its dependencies have changed?,828075
python;ctypes;,Python double pointer,828139
python;,file handling in python,828214
python;serialization;pickle;,Python - Save the context,828494
python;list;dictionary;,List a dictionary,828578
python;django;postgresql;caching;memcached;,How to measure Django cache performance?,828702
python;debugging;swig;,Debugging swig extensions for Python,828843
python;,Is Python2.6 stable enough for production use?,828862
python;import;module;multiprocessing;,Using Python multiprocessing while importing a module via file path,829123
python;django;post;webforms;,"Django: custom constructor for form class, trouble with accessing data from request.POST",829156
python;documentation;,What is the proper procedure for offering a patch to the Python documentation?,829341
python;,str.format() -> how to left-justify,829667
python;module;mosso;cloudfiles;,Mosso Python Module,829916
python;image-processing;colors;python-imaging-library;crop;,Python's PIL crop problem: color of cropped image screwed,830366
python;google-app-engine;exception-handling;web-applications;,design for handling exceptions - google app engine,830597
python;iterator;for-loop;lxml;,Python Iterator Help + lxml,830600
python;decorator;,Python convert args to kwargs,830937
python;beautifulsoup;,"Using Beautiful Soup, how do I iterate over all embedded text?",830997
python;com;,How to make a persistent com server in Python,831217
python;windows;django;,A production ready server to serve django on win32,831288
java;python;windows;telnet;,How do you create an anonymous Python telnet connection?,831679
python;turtle-graphics;,"Python imaging, resize Turtle Graphics window",831894
python;django;django-admin;scaffolding;,Scaffold or django-admin without Auth app,831934
python;import;packages;,Python: Finding all packages inside a package,832004
php;python;ruby;,"What tools do web developers use with PHP, Ruby on Rails, Python, etc?",832017
python;windows;django;,How to set up Python in a web server?,832140
python;windows;command-line;,Launch a webpage on a Firefox (win) tab using Python,832331
python;,Duplicate text detection / hashing,832485
python;screen-scraping;,What is the best way to programmatically log into a web site in order to screen scrape? (Preferably in Python),832673
python;pdf;xhtml;latex;,PDF Tables of Arbitrary (within reason) Width,832693
python;windows-services;tcp;,Cannot access Python server running as Windows service,833062
python;c;iterator;jit;algol68;,Python style iterators in C,833063
python;,How to run a script without being in the tasktray?,833356
python;django;facebook;,Need help for developing facebook app,833406
python;unix;,What i need to install python 2.5 on SCO 5.0.5,833624
python;unit-testing;testing;sqlalchemy;nose;,I need a sample of python unit testing sqlalchemy model with nose,833626
python;http;cgi;,Returning http status codes in Python CGI,833715
python;multithreading;sockets;tcp;,Threading TCP Server as proxy between connected user and unix socket,833962
python;64bit;ubuntu-8.04;igraph;,How to install python-igraph on Ubuntu 8.04 LTS 64-Bit?,834076
python;graph;ascii;,Python ASCII Graph Drawing,834395
python;database;full-text-search;fuzzy-search;,How to do fuzzy string search without a heavy database?,834570
python;database;orm;sqlalchemy;,Mapping a database table to an attribute of an object,834722
python;ftp;performance;dos;,Python's FTPLib too slow?,834840
java;python;authentication;encryption;hash;,authentication method,834932
python;,Python dictionary: are keys() and values() always the same order?,835092
python;oop;inheritance;override;immutability;,Extending Python's builtin Str,835469
python;list-comprehension;,Can I use a List Comprehension to get Line Indexes from a file?,835572
python;sqlalchemy;python-elixir;,Elixir (SqlAlchemy): relations between 3 tables with composite primary keys,835834
python;http-headers;pylons;,How can I set a custom response header for pylons static (public) files?,836191
python;list;duck-typing;,How can I tell if a python variable is a string or a list?,836387
python;windows;scripting;itunes;aac;,How to programatically combine two aac files into one?,836842
python;google-app-engine;transactions;gae-datastore;gae-ds-transactions;,datastore transaction restrictions,836992
python;forms;urllib2;urllib;,Form Submission in Python Without Name Attribute,837195
python;ruby;,How do I invoke Python code from Ruby?,837256
python;linux;file-io;,Find the oldest file (recursively) in a directory,837606
python;django;slug;,How do I create a slug in Django?,837828
python;google-app-engine;subdomain;,Working with subdomain in google app engine,838078
python;dictionary;deep-copy;,Python dictionary deepcopy,838642
python;cgi;stdin;,Python cgi and stdin,838991
python;database;sqlite;,cursor.rowcount always -1 in sqlite3 in python3k,839069
python;twisted;protocols;p2p;,Twisted and p2p applications,839384
python;exception;,Best Practices for Python Exceptions?,839636
python;time;python-2.5;time-t;year2038;,How to use time > year 2038 on official Windows Python 2.5,839755
python;url;parsing;,Extracting a URL in Python,839994
python;logging;popen;,Popen log management question,840531
python;api;sorting;photobucket;,Sort lexicographically?,840637
python;,How do you alias a python class to have another name without using inheritance?,840969
python;algorithm;discrete-mathematics;string-search;,Computing the second (mis-match) table in the Boyer-Moore String Search Algorithm,840974
python;python-2.7;storage;bit;data-compression;,How do you store raw bytes as text without losing information in python 2.x?,840981
python;audio;binary;wav;,How to edit raw PCM audio data without an audio library?,841049
python;url;mod-python;friendly-url;,mod_python publisher and pretty URLs,841068
python;yacc;lex;ply;,Tokenizing left over data with lex/yacc,841159
python;wxpython;scroll;,wxPython: Drawing inside a ScrolledPanel,841425
python;lambda;,What's going on with the lambda expression in this python function?,841555
python;,python: can I extend the upper bound of the range() method?,841584
python;sdl;pygame;,"Pygame cannot find include file ""sdl.h""",841654
python;odbc;,Python: ODBC Exception Handling,841968
python;sql;django;django-queryset;django-aggregation;,Django equivalent of COUNT with GROUP BY,842031
python;portability;username;,Is there a portable way to get the current username in Python?,842059
java;python;ruby;user-interface;cross-platform;,Practical GUI toolkit?,842075
python;windows;scripting;batch-file;io;,Piping Batch File output to a Python script,842120
python;floating-point;,"Which is more accurate, x**.5 or math.sqrt(x)?",842245
python;,How to prevent a block of code from being interrupted by KeyboardInterrupt in Python?,842557
python;,What are some good ways to set a path in a Multi-OS supported Python script,842570
python;ruby;search;file;grep;,find in files using ruby or python,842598
python;unicode;,how to use list of python objects whose representation is unicode,842696
python;sql-server;django;pyodbc;,Using Sql Server with Django in production,842831
python;regex;string;substring;,What's the most efficient way to find one of several substrings in Python?,842856
python;django;filter;django-views;django-queryset;,How can I use Django admin list and filterering in my own views?,843182
python;xml;web-applications;screen-scraping;beautifulsoup;,How to render contents of a tag in unicode in BeautifulSoup?,843227
python;windows;,Logout or switch user in Windows using Python,843268
python;exception;variables;,How do I check if a variable exists?,843277
python;windows;django;django-admin;,Why is django giving error: no module named django.core?,843383
python;urllib;forwarding;,Python: get http headers from urllib call?,843392
python;matplotlib;plot;3d;,Barchart (o plot) 3D in Python,843449
