Tags,Question,Answer
python;,Read the last lineof the file,327776
python;django;,Django equivalent for count and group by,327807
python;drawing;pygame;,how to draw lines on a picture background in pygame,327896
python;file;,How do I modify the last line of a file?,327985
python;wxpython;spreadsheet;wx;,wxpython: Updating a dict or other appropriate data type from wx.lib.sheet.CSheet object,328003
python;,Create a List that contain each Line of a File,328059
python;transparency;pygame;,How to make a surface with a transparent background in pygame,328061
python;math;geometry;,How can you determine a point is between two other points on a line segment?,328107
python;html;text;html-content-extraction;,Extracting text from HTML file using Python,328356
python;winapi;,Monitoring a displays state in python?,328490
python;winapi;,Setting monitor power state in python?,328492
python;naming;package;conventions;deploying;,Deploying a python application with shared package,328568
python;locale;ncurses;,python curses.ascii depending on locale?,328793
python;class;,Printing all instances of a class,328851
python;string;bignum;,long <-> str binary conversion,328964
python;rational-numbers;,Pure Python rational numbers module for 2.5,329333
python;,How to find all built in libraries in Python,329498
python;django;content-management-system;web-testing;,Python CMS for my own website?,329706
python;iterator;list-comprehension;,"In Python, is there a concise way to use a list comprehension with multiple iterators?",329886
python;linux;cryptography;crypt;,Python crypt module -- what's the correct use of salts?,329956
python;django;admin;,Replace textarea with rich text editor in Django Admin?,329963
python;regex;,Parsing a string for nested patterns,330334
python;web-applications;concurrency;persistence;,How would one make Python objects persistent in a web-app?,330367
python;jython;date-conversion;,jython date conversion,330383
python;multithreading;fork;cherrypy;,CherryPy for a webhosting control panel application,330573
python;,How to quickly parse a list of strings,330900
python;linux;deployment;,How to pack python libs I'm using so I can distribute them with my app and have as few dependencies as possible,331377
python;coding-style;,Python style,331767
python;http;http-headers;,How to determine if a page is being redirected,331855
python;pdf;imagemagick;jpeg;python-imaging-library;,Converting a PDF to a series of images with Python,331918
python;,Difference between class foo and class foo(object) in Python,332255
python;graph;matplotlib;plot;visualization;,How do you change the size of figures drawn with matplotlib?,332289
python;,Integer (representing a sequence of bits) reinterpretation as Character Array in Python,333097
python;google-app-engine;redirect;decorator;,getting redirect loop for admin_only decorator,333487
python;,string.split(text) or text.split() what's the difference?,333706
python;,How to detect that Python code is being executed through the debugger?,333995
python;function;dictionary;parameters;keyword;,Passing a dictionary to a function in python as keyword parameters,334655
python;symbian;s60;pys60;,Does PyS60 produce sis files that are native?,334765
python;django;image;python-imaging-library;,How to generate a filmstrip image in python from a folder of images?,334827
python;django;django-models;,How do I create trivial customized field types in Django models?,334992
python;,What's the best way to get the size of a folder and all the files inside from python?,335078
python;google-app-engine;,detecting if a module is imported inside the app engine environment,335399
python;smtp;smtpd;,Python: smtpd (or alternative) for production mail receiving?,335582
python;configparser;,Lists in ConfigParser,335695
python;osx;bash;launchd;moinmoin;,Shell Script doesn't run automatically though it is registered in Mac OS X Login Items,335891
python;image-processing;python-imaging-library;,How to complete this python function to save in the same folder?,335896
python;gtk;pygtk;glade;,How to handle a glade project with many windows,336013
python;octal;,Python: Invalid Token,336181
java;python;email;jython;winmail.dat;,How do I handle Microsoft outlook winmail.dat? Any other surprises?,336517
python;django;forms;,Django FormWizard and Admin application,336753
python;ajax;user-interface;,How to implement a minimal server for AJAX in Python?,336866
python;optparse;,Python optparse metavar,336963
python;,Python: item for item until stopterm in item?,337223
python;mysql;,How to get a row-by-row MySQL ResultSet in python,337479
python;,Dynamic Keyword Arguments in Python?,337688
python;select;timeout;subprocess;popen;,"Python, Popen and select - waiting for a process to terminate or a timeout",337863
python;multithreading;subprocess;,Python subprocess.call() fails when using pythonw.exe,337870
python;windows;pylucene;jcc;,Windows build for PyLucene+JCC on python 2.6,338008
python;osx;configuration;emacs;ipython;,How do I use IPython as my Emacs Python interpreter?,338103
python;wxpython;,Setting the width of a wxPython TextCtrl in number of characters,338217
python;logging;,TimedRotatingFileHandler Changing File Name?,338450
python;importerror;python-import;,python ImportError No module named,338768
python;string;,Nicest way to pad zeroes to string,339007
python;compression;zip;unzip;,How do you unzip very large files in python?,339053
python;dsl;dsl-tools;,Writing a compiler for a DSL in python,339217
python;django;django-forms;cleaned-data;,Problems raising a ValidationError on a Django Form,339387
python;,"End-line characters from lines read from text file, using Python",339537
python;regex;datetime;,How do I strptime from a pattern like this?,339856
.net;python;ironpython;,Proxy objects in IronPython,340093
c#;python;unit-testing;ironpython;,IronPython For Unit Testing over C#,340128
php;python;,Is rewriting a PHP app into Python a productive step?,340318
python;paramiko;,Suppressing Output of Paramiko SSHClient Class,340341
python;windows;,How can I reboot a Windows XP64 Machine in a Python Script?,341138
python;windows;python-3.x;compatibility;,Can I install Python 3.x and 2.x on the same computer?,341184
python;django;decorator;,Python Decorators run before function it is decorating is called?,341379
python;deployment;shared-libraries;projects-and-solutions;,Best way of sharing/managing our internal python library between applications,342425
python;django;logging;,Python logging in Django,342434
python;migration;module;code-migration;,Best way to import version-specific python modules,342437
python;multiprocessing;python-2.6;,Python 2.6 multiprocessing.Queue compatible with threads?,342556
python;winapi;,How should I learn to use the Windows API with Python?,342729
python;python-3.x;py2to3;,"Problem regarding 3.0's ""hashlib"" module",343204
python;geometry;polygon;computational-geometry;cgal;,What happened to the python bindings for CGAL?,343210
python;graphics;wxpython;pygame;,What can Pygame do in terms of graphics that wxPython can't?,343505
python;git;module;,How do I work with multiple git branches of a python module?,343517
python;django;testing;parsing;form-submit;,How do I submit a form given only the HTML source?,343622
python;wiki;moinmoin;,How to use InterWiki links in moinmoin?,343769
javascript;python;gis;arcgis-js-api;proj4js;,How to convert from UTM to LatLng in python or Javascript,343865
python;windows;notifications;,Notification Library for Windows,344442
python;xml;performance;large-files;expat-parser;,What is the most efficient way of extracting information from a large number of xml files in python?,344559
python;django;image;python-imaging-library;,Having problem importing the PIL image library,344753
python;django;django-models;,Looking for input in model design for Django Schools,344826
python;django;django-admin;,"Django Admin's ""view on site"" points to example.com instead of my domain",344851
python;django;foreign-keys;manytomanyfield;limit-choices-to;,Django MTMField: limit_choices_to = other_ForeignKeyField_on_same_model?,345401
coding-style;python;,"Is this idiom pythonic? (someBool and ""True Result"" or ""False Result"")",345745
python;configuration;module;,Refactoring python module configuration to avoid relative imports,345746
python;logging;opengl;wxpython;pyopengl;,"Python - No handlers could be found for logger ""OpenGL.error""",345991
python;database;postgresql;,Postgres - how to return rows with 0 count for missing data?,346132
python;file;urllib2;,Read file object as string in python,346230
python;regex;,Python regex,346267
python;django;django-tagging;,Installation problems with django-tagging,346426
python;django;,Format numbers in django templates,346467
python;import;,"Is it more efficient to use ""import <module>"" or ""from <module> import <func>""?",346723
python;algorithm;math;,Ticking function grapher,346823
python;django;templates;django-flatpages;,Django.contrib.flatpages without models,346840
python;arrays;scheme;,Questions for python->scheme conversion,347010
php;asp.net;python;linux;,Where do I go from here -- regarding programming?,347054
python;unit-testing;,How do I concisely implement multiple similar unit tests in the Python unittest framework?,347109
python;kde;,Can I use Python to intercept global keystrokes in KDE?,347475
python;frameworks;,Emitting headers from a tiny Python web-framework,347497
python;algorithm;math;,Rounding float to the nearest factor?,347538
python;unit-testing;nose;,How do I get nose to discover dynamically-generated testcases?,347574
python;content-type;mod-python;,mod_python.publisher always gives content type 'text/plain',347632
python;algorithm;pi;,Gauss-Legendre Algorithm in python,347734
python;algorithm;primes;,AKS Primes algorithm in Python,347811
python;django;caching;django-cache;,How to test django caching?,347812
python;content-management-system;plone;zope;,What could justify the complexity of Plone?,348044
python;list;object;loops;,Creating a list of objects in Python,348196
python;email;,Receive and send emails in python,348392
java;python;perl;gmail;,How can I download all emails with attachments from Gmail?,348630
python;mime-types;,Adding a mimetype in python,348999
python;refactoring;list;,Formatting a data structure into a comma-separated list of arguments,349175
python;django;inheritance;django-models;,"How do I find the ""concrete class"" of a django model baseclass",349206
python;web-services;,How do I pass a python list in the post query?,349369
python;windows;,Run a shortcut under windows,349653
python;algorithm;sorting;,Getting the lesser n elements of a list in Python,350519
python;c;refcounting;,Why is my Python C Extension leaking memory?,350647
python;django;class;django-forms;contacts;,How does Django Know the Order to Render Form Fields?,350799
python;methods;set;,What does the function set use to check if two objects are different?,351271
python;html;cgi;,Determine record in multi record html form,351440
python;shell;curl;urllib;os.system;,How do I get data from stdin using os.system(),351456
python;testing;imap;mocking;,"How do I mock an IMAP server in Python, despite extreme laziness?",351656
python;dsl;,Python method arguments with spaces,351760
python;tkinter;,destroying a Toplevel tk window in python,351821
python;gmail;imap;,Python imaplib Gmail authenticate failure,351927
python;coding-style;idioms;,Most pythonic form for mapping a series of statements?,352076
python;django;google-app-engine;middleware;django-middleware;,How to adding middleware to Appengine's webapp framework?,352079
python;file;mime-types;download;,Return file from python module,352340
python;string;,Capitalize a string,352478
python;,Extending builtin classes in python,352537
python;algorithm;random;random-sample;,Weighted random selection with and without replacement,352670
python;linux;bash;unix;shell;,How to add file extensions based on file type on Linux/Unix?,352837
python;linux;,Making Python default to another version installed on a shared host,353148
python;,How to work with very long strings in Python?,353152
python;pygame;,How to blend drawn circles with pygame,353297
python;django;,Cleaner way to query on a dynamic number of columns in Django?,353489
python;django;django-models;django-apps;,Beginner: Trying to understand how apps interact in Django,353571
python;casting;floating-point;type-conversion;,How do I check if a string is a number (float) in Python?,354038
python;vim;,How to configure vim to not put comments at the beginning of lines while editing python files,354097
python;productivity;,"Are there statistical studies that indicates that Python is ""more productive""?",354124
python;soappy;,Adding a SOAP header to a SOAPpy request,354370
python;,How is ** implemented in Python?,354421
python;django;django-models;,How can I get the number of records that reference a particular foreign key in Django?,354755
python;coding-style;return;return-value;,How do you return multiple values in Python?,354883
java;python;sql-server;formatting;jython;,mssql handles line returns rather awkwardly,355135
python;attributes;,A get() like method for checking for Python attributes,355539
python;web-crawler;,Save a deque in a text file,355739
python;math;nth-root;,How to compute the nth root of a very big integer,356090
python;iis;stdout;fastcgi;,Python FastCGI under IIS - stdout writing problems,356138
python;scripting;python-embedding;,Minimal Python build for my application's scripting needs?,356452
python;regex;findall;,Python regex findall numbers and dots,356483
python;parsing;indentation;lexer;,How would you parse indentation (python style)?,356638
python;,How to handle constructors or methods with a different set (or type) of arguments in Python?,356718
python;process;pexpect;,"Pexpect, running ssh-copy-id is hanging when trying to spawn a second process",356830
python;sockets;multiprocessing;,Proper way of cancelling accept and closing a Python processing/multiprocessing Listener connection,357656
python;vim;folding;,What is the recommended way to use Vim folding for Python code,357785
python;variables;scope;,A small question about python's variable scope,357810
python;,Problem with Python implementation of Conway's Game of Life,357968
python;class;anonymous-class;,Does Python have something like anonymous inner classes of Java?,357997
python;wxpython;,Can I use chart modules with wxpython?,358189
java;python;log4j;jython;,log4j with timestamp per log entry,358225
python;google-app-engine;post;get;,Keeping a variable around from post to get?,358398
python;serial-port;file-transfer;xmodem;,XMODEM for python,358471
python;pexpect;,"python, set terminal type in pexpect",358783
python;windows;subprocess;,Execute Commands Sequentially in Python,359347
python;postgresql;sqlalchemy;,What is the sqlalchemy equivalent column type for 'money' and 'OID' in Postgres?,359409
python;dll;ctypes;,How can I unload a DLL using ctypes in Python?,359498
python;,Comparing List of Arguments to it self?,359903
python;html;plone;zope;,Split HTML after N words in python,360036
python;lambda;,Lambda function for classes in python?,360368
python;regex;,Regular Expressions in unicode strings,360600
python;windows;linux;native;gui-toolkit;,What GUI toolkit looks best for a native LAF for Python in Windows and Linux?,360602
python;ipv6;,Extract ipv6 prefix in python,360782
python;apache;cvs;sspi;,Access CVS through Apache service using SSPI,360911
python;regex;,Need Help Understanding how to use less complex regex in Python,361443
python;sql;database;,Techniques for data comparison between different schemas,361945
python;search;,Python: Finding partial string matches in a large corpus of strings,362231
php;python;sql;mysql;shell;,Is there a standalone alternative to activerecord-like database schema migrations?,362334
python;command-line;user-interface;,"Implementing a ""[command] [action] [parameter]"" style command-line interfaces?",362426
python;serialization;pickle;pys60;,Serializing a Python object to/from a S60 phone,362484
python;numpy;,How do I add a guard ring to a matrix in NumPy?,362489
python;emacs;editing;,Switching from python-mode.el to python.el,362522
python;django;dns;,django is very slow on my machine,362808
python;orm;sqlalchemy;,Best way to organize the folders containing the SQLAlchemy models,362998
python;regex;,Regex Problem Group Name Redefinition?,363171
python;wxpython;,Equivalent of an HTML multiple SELECT box in wxPython,363907
python;idioms;python-2.4;,Python idiom to return first item or None,363944
python;,Best way to monitor services on a few servers with python,363968
python;django;django-models;django-templates;,MVC and django fundamentals,364015
python;user-interface;markup;,Markup-based GUI for python,364327
python;django;multithreading;apache;,Threaded code on mod_python,364358
php;python;perl;eclipse;,"Which Eclipse distribution is good for web development using Python, PHP, or Perl?",364486
python;dictionary;,"In Python, how do I iterate over a dictionary in sorted order?",364519
python;list;,How to get item's position in a list?,364621
python;xcode;osx;path;,How do I use my standard python path when running python scripts from xcode macros,364655
python;,generator comprehension,364802
python;winapi;,Detect windows logout in Python,365058
python;django;django-admin;django-forms;,Can you change a field label in the Django Admin application?,365082
python;cross-platform;time-management;keylogger;,Cross platform keylogger,365110
python;,run a function in another function in N times,365384
python;numpy;,How to truncate matrix using NumPy (Python),365395
python;html;css;formatting;,best way to print data in columnar format?,365601
python;redirect;urllib2;,Tracking redirects and cookies with Python,366037
python;url-routing;cherrypy;turbogears;,how to browse to a external url from turbogears/cherrypy application?,366421
python;,What is the pythonic way to avoid default parameters that are empty lists?,366422
python;multithreading;,How to limit execution time of a function call in Python,366682
python;low-level;,Bitwise subtraction in Python,366706
python;unit-testing;python-nose;,How to organize python test in a way that I can run all tests in a single command?,366720
python;django;localization;internationalization;,How to localize Content of a Django application,366838
python;google-app-engine;model;referenceproperty;,Deleting erroneous ReferenceProperty properties in AppEngine,367029
python;multithreading;io;multiprocessing;,No print output from child multiprocessing.Process unless the program crashes,367053
python;cross-platform;process;,Listing the processes running on one's computer in Python,367068
python;perl;command-line;language-features;,Is there a Python equivalent to `perl -pi -e`?,367115
python;string;split;,Splitting a string into words and punctuation,367155
python;django;inheritance;django-models;,Setting up a foreign key to an abstract base class with Django,367461
python;validation;,How much input validation should I be doing on my python functions/methods?,367560
python;numpy;generator;,How do I build a numpy array from a generator?,367565
python;string;random;,Generating random text strings of a given pattern,367586
python;opengl;graphics;pyglet;glreadpixels;,Get Data from OpenGL glReadPixels(using Pyglet),367684
python;email;sorting;mbox;,How can I reorder an mbox file chronologically?,368003
python;import;module;,Making a virtual package available via sys.modules,368057
python;while-loop;,How can I stop a While loop?,368545
python;packaging;setuptools;pip;,Questions about Setuptools and alternatives,368636
python;unicode;ascii;encode;ignore;,Python UnicodeDecodeError - Am I misunderstanding encode?,368805
c++;python;swig;,Passing a Python array to a C++ vector using Swig,368980
python;xml;django;json;serialization;,What is the best way to serialize a ModelForm object in Django?,369230
python;python-dateutil;,using existing rrule to generate a further set of occurrences,369261
python;django;apache;,Is there anyone who has managed to compile mod_wsgi for apache on Mac OS X Leopard?,369305
python;ruby;interpreter;,Is there an OpenSource BASIC interpreter in Ruby/Python?,369391
python;ssh;,Python: os.environ.get('SSH_ORIGINAL_COMMAND') returns None,369414
java;python;nat;discovery;,How to discover the type of the NAT a given interface is behind,369664
python;ipv6;packet-capture;pcap;,IPv6 decoder for pcapy/impacket,369764
python;dictionary;,Difference between dict.clear() and assigning {} in Python,369898
python;timezone;command-line-interface;,command-line world clock?,370075
python;sqlalchemy;,How do I put a SQLAlchemy label on the result of an arithmetic expression?,370077
python;sqlalchemy;,How do I ORDER BY an arithmetic express in SQLAlchemy?,370160
python;sqlalchemy;,"SQLAlchemy with count, group_by and order_by using the ORM",370174
python;variables;scope;,Python variable scope error,370357
python;pygame;pyglet;,Differences between Python game libraries Pygame and Pyglet?,370680
python;documentation;trac;,Trac documentation?,370733
python;ide;netbeans;,Has anyone tried NetBeans 6.5 Python IDE?,371037
python;clr;,String conversion in Python,371155
python;idioms;,What's the most pythonic way of testing that inputs are well-formed numbers,371419
python;oop;class;recursion;,Python - Using __getattribute__ method,371753
python;whitespace;,When is white space not important in Python?,372007
python;interface;abstract-class;,Difference between abstract class and interface in Python,372042
python;regex;,UTF in Python Regex,372102
python;xml-rpc;,Set timeout for xmlrpclib.ServerProxy,372365
python;security;apache;download;lighttpd;,Protecting online static content,372465
python;oop;data-analysis;,What is the object oriented programming computing overhead cost?,372511
python;mysql;,How do I connect to a MySQL Database in Python?,372885
python;objective-c;cocoa;osx;,Finding the Current Active Window in Mac OS X using Python,373020
python;,List all the classes that currently exist,373067
python;twisted;,XPath in XmlStream.addObserver doesn't work the way it should,373189
python;regex;md5;,Python regex for MD5 hash,373194
python;user-interface;tkinter;easygui;,Close an easygui Python script with the standard 'close' button,373212
python;cron;,How do I get a Cron like scheduler in Python?,373335
python;datetime;timezone;utc;pytz;,"How do I get the UTC time of ""midnight"" for a given timezone?",373370
javascript;python;sandbox;,"Secure, sandboxable user exposed programming language / environment?",373406
python;string;split;,split string on a number of different characters,373459
python;ssh;paramiko;,Running interactive commands in Paramiko,373639
c++;python;data-structures;enums;header;,Convert C++ Header Files To Python,374217
python;celementtree;,How to retrieve the parent node using cElementTree?,374245
python;string;unicode;unsigned;signed;,conversion of unicode string in python,374318
python;unit-testing;,Where is a python real project to be used as example for the unit-test part?,374480
python;variables;,need help-variable creation in Python,374572
python;,"How can I find all the subsets of a set, with exactly n elements?",374626
python;coding-style;,Should I use get_/set_ prefixes in Python method names?,374763
python;file-io;error-handling;,How do you test a file.read() error in Python?,374768
python;api;osc;ableton-live;,How to send clip names using LiveAPI (of Ableton Live),375052
python;file;time;,How do I get the time a file was last modified in Python?,375154
python;io;subprocess;nonblocking;,Non-blocking read on a subprocess.PIPE in python,375427
python;ftp;ftplib;,Prevent ftplib from Downloading a File in Progress?,375620
python;wxpython;wxwidgets;,How do I create a wx.Image object from in-memory data?,375820
python;vim;,How do you override vim options via comments in a python source code file?,376111
java;python;excel;,Programmatic mail-merge style data injection into existing Excel spreadsheets?,376221
python;string;string-concatenation;,String concatenation vs. string substitution in Python,376461
java;python;ide;,IntelliJ Python plug-in,376765
python;variables;,need help-variable creation in Python (continuation),377000
python;path;,Test if executable exists in Python?,377017
python;wxpython;wxwidgets;listctrl;,How to set and preserve minimal width?,377204
python;multithreading;concurrency;multicore;python-stackless;,Stackless python and multicores?,377254
python;model-view-controller;oop;coding-style;,OOP and MVC programming style,377337
python;,Code not waiting for class initialization!,377362
python;timer;sleep;,How do I get my python program to sleep for 50 milliseconds?,377454
python;regex;postal-code;,"Python, Regular Expression Postcode search",378157
python;django;dictionary;permissions;,How to get a list of all users with a specific permission group in Django,378303
python;exception;inheritance;,Problem sub-classing BaseException in Python,378493
python;design;asynchronous;,Idiomatic asynchronous design,378564
python;c;,How do I create a Python class in C?,378773
python;,"Getting python to work, Internal Server Error",378811
python;syntax;decorator;,What does the []-esque decorator syntax in Python mean?,379291
python;cherrypy;stringtemplate;,How to integrate the StringTemplate engine into the CherryPy web server,379338
python;documentation;javadoc;,What are these tags @ivar @param and @type in python docstring?,379346
c++;python;performance;drawing;wxpython;,How much slower is a wxWidget written in Python versus C++?,379442
